{
  "proposal_id": "quality_20260710_194449_002",
  "agent_id": "quality",
  "run_id": "run_quality_20260710_194445",
  "created_at": "2026-07-10T19:44:49Z",
  "status": "pending_review",
  "origin": "deterministic",
  "task": {
    "id": "task_quality_daily_scan",
    "type": "quality",
    "scope": "Scan qualité complet déterministe (couverture, liens, notices, IDs, versions, pages IA, matrices, routage)."
  },
  "target": {
    "file": "ia/",
    "section": "notices PDF résolues sur disque"
  },
  "source": {
    "type": "repo",
    "document": "scripts/build_ia.py + ia/",
    "excerpt": "0/11 notices résolues"
  },
  "proposed_change": {
    "operation": "report",
    "payload": {
      "check": "notices PDF résolues sur disque",
      "detail": "0/11 notices résolues",
      "severity": "warn"
    }
  },
  "reasoning_summary": "Contrôle qualité déterministe en échec : notices PDF résolues sur disque — 0/11 notices résolues",
  "confidence": 0.99,
  "ambiguities": [],
  "risks": [
    "signal de qualité ; aucune correction appliquée automatiquement"
  ],
  "validation_required": true,
  "regulatory_status": "none",
  "automatic_checks": {
    "schema_valid": true,
    "source_resolves": true,
    "duplicate_detected": false,
    "scope_allowed": true
  }
}
