{
  "proposal_id": "extraction_llm_20260711_172002_001",
  "agent_id": "extraction-llm",
  "run_id": "run_extraction-llm_20260711_171959",
  "created_at": "2026-07-11T17:20:02Z",
  "status": "pending_review",
  "origin": "llm",
  "task": {
    "id": "task_extraction_llm_micro_zones",
    "type": "extraction",
    "scope": "Micro-zones (2-5 pages) des notices a trous de couverture ; l'agent choisit la zone suivante via sa memoire."
  },
  "target": {
    "contract": "essen_ciel_patrimoine",
    "file": "data/AXA/AXA_MASTER_DONNEES_PACK_A_STABLE.json",
    "section": "cotisations"
  },
  "source": {
    "type": "pdf",
    "document": "2023-09 Notice d'information Essen'Ciel Patrimoine.pdf",
    "page": 13,
    "url": null,
    "excerpt": "les 2 adhésions bénéficient d’une réduction permanente de 10 % sur l’ensemble des cotisations"
  },
  "proposed_change": {
    "operation": "add",
    "payload": {
      "categorie": "cotisations",
      "texte": "Réduction de 10% sur les cotisations en cas d'adhésion simultanée du conjoint",
      "diff": "Ajoute une règle de réduction tarifaire absente des données précédentes.",
      "closest_existing": "",
      "confidence_reason": "Confiance 0.90 : citation nette ; formulation ambiguë.",
      "importance": "moyenne",
      "review_cost": "30 s",
      "target_path": "AXA_MASTER_DONNEES_PACK_A_STABLE.json :: contrat[\"Essen'Ciel Patrimoine\"] / cotisations",
      "citation_exacte": "les 2 adhésions bénéficient d’une réduction permanente de 10 % sur l’ensemble des cotisations",
      "why_missing": "nouveau contrat",
      "why_interesting": "Détaille une condition tarifaire spécifique liée à la situation familiale.",
      "why_probably_absent": "nouveau contrat",
      "documentary_interest": 0.9,
      "priority_level": "haute",
      "value_score": 0.928,
      "bloc": []
    }
  },
  "reasoning_summary": "Détaille une condition tarifaire spécifique liée à la situation familiale.",
  "confidence": 0.9,
  "ambiguities": [],
  "risks": [
    "validation notice PDF obligatoire ; master jamais modifie",
    "citation verifiee presente sur la page citee"
  ],
  "validation_required": true,
  "regulatory_status": "none",
  "automatic_checks": {
    "schema_valid": true,
    "source_resolves": true,
    "duplicate_detected": false,
    "scope_allowed": true
  }
}
