{
  "proposal_id": "extraction_llm_20260711_173821_003",
  "agent_id": "extraction-llm",
  "run_id": "run_extraction-llm_20260711_173818",
  "created_at": "2026-07-11T17:38:21Z",
  "status": "pending_review",
  "origin": "llm",
  "task": {
    "id": "task_extraction_llm_micro_zones",
    "type": "extraction",
    "scope": "Micro-zones (2-5 pages) des notices a trous de couverture ; l'agent choisit la zone suivante via sa memoire."
  },
  "target": {
    "contract": "essen_ciel_patrimoine",
    "file": "data/AXA/AXA_MASTER_DONNEES_PACK_A_STABLE.json",
    "section": "conditions"
  },
  "source": {
    "type": "pdf",
    "document": "2023-09 Notice d'information Essen'Ciel Patrimoine.pdf",
    "page": 17,
    "url": null,
    "excerpt": "Chaque assuré fait l’objet d’une sélection médicale. L’assureur peut limiter ou refuser les garanties ou appliquer une surprime sans avoir à justifier sa décision."
  },
  "proposed_change": {
    "operation": "add",
    "payload": {
      "categorie": "conditions",
      "texte": "Sélection médicale à l'adhésion",
      "diff": "Définit le processus d'acceptation médicale.",
      "closest_existing": "",
      "confidence_reason": "Confiance 0.95 : citation nette.",
      "importance": "critique",
      "review_cost": "2 min",
      "target_path": "AXA_MASTER_DONNEES_PACK_A_STABLE.json :: contrat[\"Essen'Ciel Patrimoine\"] / conditions",
      "citation_exacte": "Chaque assuré fait l’objet d’une sélection médicale. L’assureur peut limiter ou refuser les garanties ou appliquer une surprime sans avoir à justifier sa décision.",
      "why_missing": "nouveau contrat",
      "why_interesting": "Condition sine qua non pour l'acceptation du risque par l'assureur.",
      "why_probably_absent": "nouveau contrat",
      "documentary_interest": 0.9,
      "priority_level": "moyenne",
      "value_score": 0.65,
      "bloc": []
    }
  },
  "reasoning_summary": "Condition sine qua non pour l'acceptation du risque par l'assureur.",
  "confidence": 0.95,
  "ambiguities": [],
  "risks": [
    "validation notice PDF obligatoire ; master jamais modifie",
    "citation verifiee presente sur la page citee"
  ],
  "validation_required": true,
  "regulatory_status": "none",
  "automatic_checks": {
    "schema_valid": true,
    "source_resolves": true,
    "duplicate_detected": false,
    "scope_allowed": true
  }
}
