{
  "proposal_id": "extraction_llm_20260816_184938_002",
  "agent_id": "extraction-llm",
  "run_id": "run_extraction-llm_20260816_184934",
  "created_at": "2026-08-16T18:49:38Z",
  "status": "pending_review",
  "origin": "llm",
  "task": {
    "id": "task_extraction_llm_micro_zones",
    "type": "extraction",
    "scope": "Micro-zones (2-5 pages) des notices a trous de couverture ; l'agent choisit la zone suivante via sa memoire."
  },
  "target": {
    "contract": "essen_ciel_patrimoine",
    "file": "data/AXA/AXA_MASTER_DONNEES_PACK_A_STABLE.json",
    "section": "bloc:plafonds"
  },
  "source": {
    "type": "pdf",
    "document": "2023-09 Notice d'information Essen'Ciel Patrimoine.pdf",
    "page": 10,
    "url": null,
    "excerpt": "Le montant total pris en charge au titre de la présente garantie est limité à 600 € TTC."
  },
  "proposed_change": {
    "operation": "add",
    "payload": {
      "categorie": "plafonds",
      "texte": "Le plafond de prise en charge pour la garde des enfants est de 600 € TTC.",
      "diff": "Ajoute une limite monétaire globale.",
      "closest_existing": "",
      "confidence_reason": "Confiance 0.95 : citation nette.",
      "importance": "moyenne",
      "review_cost": "30 s",
      "target_path": "AXA_MASTER_DONNEES_PACK_A_STABLE.json :: contrat[\"Essen'Ciel Patrimoine\"] / plafonds",
      "citation_exacte": "Le montant total pris en charge au titre de la présente garantie est limité à 600 € TTC.",
      "why_missing": "nouveau contrat",
      "why_interesting": "Définit la limite financière globale pour la garde d'enfants.",
      "why_probably_absent": "nouveau contrat",
      "documentary_interest": 1.0,
      "priority_level": "haute",
      "value_score": 0.978,
      "bloc": [
        {
          "categorie": "plafonds",
          "page": 10,
          "citation": "Le montant total pris en charge au titre de la présente garantie est limité à 600 € TTC.",
          "texte": "Le plafond de prise en charge pour la garde des enfants est de 600 € TTC."
        },
        {
          "categorie": "conditions",
          "page": 10,
          "citation": "soit la garde des enfants par du personnel qualifié au domicile de l’assuré, pendant 16 heures maximum sur 2 jours suivant le décès",
          "texte": "La garde des enfants est limitée à 16 heures sur 2 jours suivant le décès."
        }
      ]
    }
  },
  "reasoning_summary": "Définit la limite financière globale pour la garde d'enfants.",
  "confidence": 0.95,
  "ambiguities": [],
  "risks": [
    "validation notice PDF obligatoire ; master jamais modifie",
    "citation verifiee presente sur la page citee"
  ],
  "validation_required": true,
  "regulatory_status": "none",
  "automatic_checks": {
    "schema_valid": true,
    "source_resolves": true,
    "duplicate_detected": false,
    "scope_allowed": true
  }
}
