{
  "proposal_id": "extraction_llm_20260711_173824_007",
  "agent_id": "extraction-llm",
  "run_id": "run_extraction-llm_20260711_173818",
  "created_at": "2026-07-11T17:38:24Z",
  "status": "pending_review",
  "origin": "llm",
  "task": {
    "id": "task_extraction_llm_micro_zones",
    "type": "extraction",
    "scope": "Micro-zones (2-5 pages) des notices a trous de couverture ; l'agent choisit la zone suivante via sa memoire."
  },
  "target": {
    "contract": "essen_ciel_assurance_obseques",
    "file": "data/AXA/AXA_MASTER_DONNEES_PACK_A_STABLE.json",
    "section": "definitions"
  },
  "source": {
    "type": "pdf",
    "document": "2025-06 Notice d'information Essen'Ciel.pdf",
    "page": 17,
    "url": null,
    "excerpt": "âge de l’adhérent calculé par différence de millésimes, entre l’année de la prise d’effet de l’adhésion et l’année de naissance de l’assuré"
  },
  "proposed_change": {
    "operation": "add",
    "payload": {
      "categorie": "definitions",
      "texte": "Définition de l'âge de l'assuré pour le calcul de la cotisation",
      "diff": "Définit le mode de calcul de l'âge (millésimes) plutôt que l'âge réel.",
      "closest_existing": "",
      "confidence_reason": "Confiance 0.95 : citation nette.",
      "importance": "moyenne",
      "review_cost": "30 s",
      "target_path": "AXA_MASTER_DONNEES_PACK_A_STABLE.json :: contrat[\"Essen'Ciel (assurance obsèques)\"] / definitions",
      "citation_exacte": "âge de l’adhérent calculé par différence de millésimes, entre l’année de la prise d’effet de l’adhésion et l’année de naissance de l’assuré",
      "why_missing": "nouveau contrat",
      "why_interesting": "Précise la méthode de calcul actuarielle utilisée par l'assureur.",
      "why_probably_absent": "nouveau contrat",
      "documentary_interest": 0.9,
      "priority_level": "haute",
      "value_score": 0.941,
      "bloc": []
    }
  },
  "reasoning_summary": "Précise la méthode de calcul actuarielle utilisée par l'assureur.",
  "confidence": 0.95,
  "ambiguities": [],
  "risks": [
    "validation notice PDF obligatoire ; master jamais modifie",
    "citation verifiee presente sur la page citee"
  ],
  "validation_required": true,
  "regulatory_status": "none",
  "automatic_checks": {
    "schema_valid": true,
    "source_resolves": true,
    "duplicate_detected": false,
    "scope_allowed": true
  }
}
